,Unnamed: 0,Unnamed: 0.1,Unnamed: 0.1.1,overall,verified,reviewTime,reviewerID,asin,style,reviewerName,reviewText,summary,unixReviewTime,vote,image
228,157,1478,1478,5.0,False,"02 8, 2014",A10P8UG177H2XR,B000HCZ8EO,{'Format:': ' Software'},cyharriscat,"Do you need a basic but .docx/.xlsx/.pptx capable version of real Microsoft Office? OpenOffice not doing a good enough job for what you need? Are you put off by Office 2013, which doesn't offer three product keys for your trouble? Are you even more put off with Microsoft turning Office into Software as a Service with Office 365?

Well, you're going to have to accept some compromises, namely the hated Ribbon and not having all the Office apps. But there are Z number of people who have late Windows XP/early Windows Vista era PCs that are perfect for secondary production running Windows 7 from a retail upgrade disk-and when you do the clean install upgrade for Windows, which you will eventually have to do due to Windows rot, you are going to need Office and you may never get up the budget to where you want to invest in Office 2010 or later for such a low-end often barely Aero-capable PC, so this is perfect as long as you temper your expectations.

With properly set expectations and a legal copy of Office 2007 Home and Student, you can now get down to how it works.

It works by running basic Word, Excel, PowerPoint, and OneNote tasks  It's not going to wow you like a new version of Office, but a common thread I've read in hundreds of reviews for various versions and editions of Office is why do they break what works in the previous version when they release a new version? Well, by buying an older version, there are no surprises as regards what Office can and can't do, because it's been around for however many years it's been since the date the version in question (Office 2007 Home and Student, which is 7 years as of when I write this) was made.

What can it actually do? Well, Word's fully featured (as long as you're using it for home or student use.) Excel is fully featured as regards the base program (again, the same caveat applies.) PowerPoint will get your presentations done, although you'll miss some of the customizations of later versions. OneNote is fully featured, and it along with PowerPoint have the caveat that they're for home or student use. The only thing that really lacks in Home and Student versus let's say Ultimate (which I use for troubleshooting through over-engineering), is the Microsoft Office Tools-you can't expect fancy things like Business Contact Manager and the accompanying copy of SQL Server 2005 Express.

In case you're wondering, I'm reviewing this for my aunt and uncle, who sat there and bought a PC in May of 2009 and thanks to a certain ability I have to troubleshoot combined with them buying retail Windows 7 Home Premium Upgrade through the Best Buy fulfillment of the Windows 7 Upgrade Option that was current at the time along with retail Office 2007 Home and Student that they beat out of HP's customer (dis)service-albeit with having to pay for it, I get to (and thoroughly enjoy) troubleshooting their PC whenever it is having an issue because I'm on a mission to keep them off of the crack Windows that is Windows 8/RT/8.1/RT 8.1/Windows Phone 8X/Windows Phone 8.1x and I thoroughly enjoy every time I can fix their PC that uses this software.

Office 2007 Home and Student was a change for them at first from the WordPerfect Office suite they were using on their old XP computer, a Dell Dimension 2400 (They replaced it with an AMD Athlon 64 X2 7750+ 4GB RAM 500GB HD HP Pavilion Slimline S5120Y. But then again so was Vista and then 7-they didn't have too much trouble with Vista, but Windows 7 Home Premium combined with this version of Office makes them able to do everything they would ever want to do with Office and a PC. When that changes, they will upgrade-and so far it's not changing.

I just think that Office 2007 (whether lowly Home and Student or mighty Ultimate or something in between like Professional) didn't deserve the reputation it got as regards the Ribbon. People were (and some still are) so angry about the Ribbon that they don't like Office because of the Ribbon. I know I am not as qualified as some people to speak due to my aversion to command line interfaces, whether of the old school DOS/Unix variety or whether of the newfangled Windows PowerShell variety, but I know this for a fact:

Once I properly configured their PC with Windows 7 Home Premium Retail Upgrade on a clean install and reimported their programs, files, and settings, they were using it productively as could be until a virus hit that forced them to pay someone way too much to repair their computer. I was able to set it right and from the moment I first showed them how to do basic things like bold, underline, italics, margins, indentation, in other words showed them where Microsoft Office 2007 Home and Student put the tools they were using in WordPerfect Office, they've been happily using Office with the Ribbon.

I hate to discount those who have had negative experiences with Office 2007, because I don't like most change-especially not the licensing restrictions growing ever tighter since 2000, but I haven't had any problems with the Ribbon either.

So with the Ribbon discounted for us and our family, we can now move on to infinitely more pressing matters. Which is how does Office (specifically 2007 Home and Student) perform in real world tasks? Well, it doesn't make you have to renew the usage rights to it every year, it supports the .docx/.xlsx/.pptx trio, and it has a user interface that aside from being different is actually usable (if you can figure out what each button on each section of the ribbon is for, which ToolTips really help with that and they're on by default).

In summation, for the reasons outlined above, Microsoft Office 2007 Home and Student is worth the money if you can get a legal copy. I recommend it as long as it's needs match up well with what you need out of (specifically Microsoft) Office,

Take this as you will, 2 families' experiences with Office 2007, one Ultimate, one Home and Student, which is positive and we continue to use Office 2007 to this day.","It's maybe behind the curve, but you can still do a lot with it.",1391817600,,
441,1937,8589,8589,4.0,True,"07 22, 2015",A1Y3PKMAQEVHK7,B00FB5R6L0,,Bruce H,Nice software to copy disks.  Easy to use,Good inexpensive software for disk copies,1437523200,,
690,2294,6541,6541,5.0,True,"01 25, 2015",A3E4OLI1U8WA5W,B008H3SW4I,{'Format:': ' Software'},Anthony C. Ho,Good stuff great quality s,Five Stars,1422144000,,
132,420,12422,12422,5.0,False,"04 25, 2013",A21S26XYPGXJZX,B001TYYZCA,,Bigdumptruck,"My step-son is an artist, and this tool kept him busy for hours, and taught him a LOT about using computer tools to create art. He has since moved on to professional drawing software, but Painter was the tool that showed him you could create real works of art on a computer.","Fun Product, Taught My Son About Computer Art",1366848000,,
534,1158,9580,9580,3.0,True,"03 30, 2015",ANFRSLQ583FE4,B00MA5TPN6,,sticks,I've been an IBM compatible computer user for years and was a Micosoft BETA tester for Windows 95 so naturally have a lot of Windows software. I recently became a Mac owner and found that many of the Windows applications I have had no Mac counterpart. Parallels seemed to be the answer. Using Parallels to run Windows reminded me of the days when Windows was an operating environment loaded after booting into DOS and it always felt that way to me. I encountered a problem in trying to print from Windows applications which rendered those applications useless. Attempts to get technical support from Parallels or Mac were fruitless. Parallels was unresponsive and Mac wanted $100 just to answer a question on the telephone. I had also purchased several Mac applications which were similar to their Windows counterpart but not as usable. I abandoned my Mac and returned to using my IBM compatible (which is nowadays called a PC). PC stands for Personal Computer which a Mac is also.,probably okay for confirmed Mac users,1427673600,,
256,869,1242,1242,5.0,True,"03 19, 2009",AW0UV7Z8909P6,B000EORV8Q,,Timothy R. Long,"First one I ever bought, so far so good.  Seems to work well and installation was easy, except that the installation instructions were difficult to follow.  I called my cable company and they helped me figure out what to do.",Wireless-G Cable/DSL Router,1237420800,,
864,1562,10911,10911,5.0,False,"12 30, 2015",A2RYWPOL4NN2KG,B010P91LYY,{'Platform:': ' PC/Mac'},Raed Haed,"I've been running Norton on my desktop for the past few years. I thought I would try this and see if I like it better. It does seem to use less resources and seems to pick up malware well. It doesn't quite have the bells and whistles that I have with the Norton. I can't get too technical on this review because I'm not a tech wiz, but it seems like McAfee runs smoother and doesn't slow down my computer as much as Norton does when it's running. I never got a virus while using Norton 360, so it'll be interesting to see how well McAfee protects me compared to Norton. So far I like it.",So far it's running well.,1451433600,3.0,
654,2796,6371,6371,4.0,False,"09 28, 2012",ALDAF4VVLFRHP,B006WVR9GY,{'Platform:': ' PC/Mac Disc'},Patricia Brouillette,"I am going to school working on my Bachelors' degree  in Photograph, I am required to use Adobe Lightroom, so when I got this, I was looking forward to see how it compared to Lightroom. It is definitely a nice and cheaper alternative, especially for beginners or just for family photos.

It isn't quite up to Lightroom, but definitely something that might be good to start out with, especially if you are a beginner and/or on a budget.

It is nice to download my sd card and being able to get an overview of all the photos that I have taken, also having a program that will organize the photos and put them in specific folders. It is a very hand program.",Cool alternative,1348790400,5.0,
582,87,9794,9794,5.0,True,"09 28, 2015",AQVNJVVCII62J,B00MV9EL6M,,Yavapaibill,Works as advertised,Excellent product,1443398400,,
200,1808,909,909,4.0,False,"06 18, 2015",A13BTMCSLTQ48R,B0002ZALES,{'Platform:': ' PC'},Llama Mama,"This game is super popular among ND fans. More than once Ive heard people say that its one of the best (if not the best) titles in the series. But it also has a reputation for being fairly scary and having very complicated puzzles. I guess it was that reputation that turned me off to this game, but I finally ended up buying it because I felt like I couldn't call myself a true Nancy Drew fan without having played Curse of Blackmoor Manor. I'm going to split my review up into different sections so I can give the game a more accurate rating.

PLOT  5/5:  This was one of the most interesting plots Ive come across in a ND game. Nancy has been asked by her neighbor, Mrs. Petrov, to fly to England and help her daughter. Her daughter Linda recently married a British diplomat named Hugh Penvellyn, but since her wedding Lindas attitude has drastically changed. She has become short tempered and paranoid and constantly getting sick, and by the time Nancy gets to Blackmoor Manor Linda has hidden herself away in her bedroom and refuses to show her face to anyone.  Blackmoor Manor has a storied reputation of secrets and witchcraft and for generations locals have believed it to be haunted by a werewolf-like monster called the Beast of Blackmoor. Its up to Nancy to get to the bottom of all of this to help Linda.

Like I said, I thought this plot was fascinating. There was so much detail put into the history of Blackmoor and the Penvellyn family history and I had so much fun unravelling it all as the plot went on. It was a great length and held my interest the whole time. I really have no complaints about the plot.

CHARACTERS  4.5/5: There was a really great cast of characters in this game. There was Linda, who I thought was very interesting and I wished I could have interacted more with her. The other residents of the house were Jane, Lindas 12 year old step daughter (also one of my new favorite characters), Hugh Penvellyns aunt Mrs. Drake, and Nigel, a historian who is currently researching Blackmoor Manor for a book he is writing on the Penvellyn family. There was also Janes tutor Ethel, but Ethel was different because you could only talk to her a couple of times over the course of the game. There was also Loulou, the annoying hint parrot. I really enjoyed the voice acting work and impressed overall with the characters.

SETTING  4.5/5: Blackmoor Manor was definitely an interesting place. It reminded me a lot of Wickford Castle from Treasure in the Royal Tower  especially the main hall. Blackmoor Manor was excessively decorated so there was plenty to look at even if some parts of it were pretty gaudy. It was huge and there was a ton to explore, not to mention lots of areas unlocked over the course of the story. I also really enjoyed the music in this game.

PUZZLES - 4/5: This was a puzzle heavy game. The puzzles ranged from ones that were quick and self-explanatory to ones that were incredibly complicated and took many different steps to complete. I used a walkthrough for most of it. I did appreciate how well thought out the puzzles were, however some of them were so long and complicated that it felt daunting having to complete them. There weren't really any chores in this game, which was good. The only thing that could come close to counting as a chore was that Jane required you to play a game with her before she would do anything for you. This was a little annoying but luckily her games were easy.

IS IT CHALLENGING? Absolutely. There was no way I could have figured out some of those puzzles without a walkthrough. 4.5/5

ENDING - 4/5: The ending was good, but not as strong as the other aspects of the game. The reveal at the end and the appearance of the culprit was kind of abrupt and a little underwhelming. The culprits motives made sense but I didn't really like who they chose as the culprit. But catching them was exciting and I liked how everything was wrapped up in the epilogue.

FINAL SCORE:
Plot: 5
Characters: 4.5
Setting: 4.5
Puzzles: 4
Challenge: 4.5
Ending: 4
= 26.5, divided by 6 = 4.41 rounded to 4 stars",Puzzles Galore,1434585600,2.0,
916,581,1668,1668,3.0,True,"11 21, 2014",A20Z9Y3POX1H28,B000U0I11A,,midwesterner,worked but not buy it again because the newer product is beter.,Three Stars,1416528000,,
391,209,4953,4953,1.0,False,"01 4, 2011",A390UFRRO2BLZS,B003YJ5DSS,"{'Format:': ' Box', 'Platform:': ' PC Disc'}",Tony Polito,"I owned Q2008, Q2005 & Q2002 and I used them daily. during that decade, I observed no significant product improvements, just a huge increase in software bugs.

Look up the Q2010 and/or Q2008 products, where I posted detailed logs/diaries of the endless bugs, errors and frustrations I endured as a Quicken user.

In August, 2010, I finally migrated to the Moneydance product and--after the migration and learning curve issues--I find it swims slick as an eel. I wish I'd done it years sooner.

Since at least 2002, Intuit has been using Quicken as a pure 'cash cow' - a product to milk revenue out of, but making no investment in it - while it continues to toy around with other new product developments toward future revenue streams.

The history of the Quicken product doesn't suggest a bright future for Quicken users. Don't get suckered into starting up with Quicken. Go with Moneydance.","A lousy, buggy product since 2002. Go with Moneydance.",1294099200,9.0,
7,2285,7037,7037,5.0,True,"03 28, 2013",A2B9N8LRE4CG7O,B009CCVMO0,{'Format:': ' Software'},Jesse Crenshaw,have used for years. This year they added he ability to download investments and have TT calculate the gains and losses.  Worth every penny.,Great as usual,1364428800,,
163,212,7688,7688,5.0,True,"03 8, 2015",A2XEQVDAPBKYF1,B00E6LJBUO,{'Format:': ' Software Download'},William,Nice...as expected,Five Stars,1425772800,,
218,565,5490,5490,5.0,True,"11 28, 2011",A2CZXRWXCCN9JX,B004Y8MKZM,{'Package Type:': ' Frustration-Free Packaging'},mkegaffer,"Love Kaspersky! If you tune it correctly, it doesn't use all of the CPU overhead that you get hit with by Norton or McAfee",Love Kaspersky!,1322438400,,
575,2106,4168,4168,4.0,False,"09 29, 2011",A3IOCPLIMYDBCD,B002CMWEY4,,Hummingbirder,"I wanted to give this a try because I was curious.  I am not a scrapbook fanatic, but I do sometimes want to create something with a personal touch.

I have used this on two laptops.  One was rather old, and it took too long to complete a project.  I happened to purchase a new laptop with a faster processor and a lot of memory and disk space.  The software is intuitive, but you'll need to visit the website for updated files. I've made up a few special cards for special people, and they were happy to receive them.

This software is too clunky for hard core paper crafters.  But if you want to try your hand at a new hobby, this is a good start.",Good for the Casual User,1317254400,,
439,288,5808,5808,5.0,True,"08 24, 2014",A7CEP1AKDJXFO,B005CELKLM,{'Platform:': ' PC Download'},Old Guy,"I am again sourly disappointed with the installation process, tech support and licensing hassles of PaperPort 14.  This install was an upgrade from PP12 because it had been reinstalled too many times, causing blockage by Nuance.  I could have called them again but it was time to get the latest version.

I am a home user, who started with PagesPro then a Xerox product.  I like the product, particularly the image printing to PDF and the PDF editing features.  I use them regularly.

Unfortunately, with this edition, after a clean re-install of WIN7 Pro 64-bit the image printer driver refused to install -- the main program installed fine.  I called Nuance support, no 800 number available, was on hold forever and the best they could do was say try reinstalling with the firewall and anti-virus disabled.  That made no sense, the main program was installed and registered.

My  problem was with the printer driver install only.  There are a lot of us with that problem.  I read their posts.  I tried many workarounds with no meaningful help from Nuance.  Finally, I found a utility in the image printer driver's program folder for reinstalling the printer driver after an OS upgrade -  WORKED LIKE A CHAMP. To bad Nuance did not know enough to tell me to try it.

ALSO, there is a known bug in the standard version of PP14's update program.  It does not report any update!  There are many workarounds on the web for that as well, however, none worked for me.  I am yet to call Nuance for their ""help"" with this known bug.  I do not hold out much hope for that.","Great product, poor company.",1408838400,7.0,
518,2933,1900,1900,5.0,True,"11 20, 2010",A3TVV8KJK832AH,B0000AZJY6,{'Color:': ' 0.3823294459'},halSoCal,"Two of these switches replaced two Linksys switches that continually needed to be re-booted.  The two Asante switches worked flawlessly for day one.  When I had a question I got outstanding support within less than 5 minutes from someone in the United States who could answer my question. As a result, I just purchased a Asante wireless router.",Works far better than Linksys switch,1290211200,,
772,2717,1022,1022,3.0,False,"02 23, 2006",A1D7X065RAZEH3,B000B8K7SG,,Elsie,"Why did they change from a previously easy to use format? Last year one could go to a ""check return for errors"" tab and it would run a program to find mistakes. This year they buried this process in a way that is hard to figure out. I realized I was lost in the program and couldn't find out what I had overlooked or how to fix it- until I finally discovered I had to go to ""show all my forms"" where they had a tiny indicator ""not done"". [...]",Why did you change your format Turbotax???????,1140652800,3.0,
708,28,5634,5634,1.0,True,"02 16, 2012",A2M3KEMN3U4IBO,B0056CZC2S,{'Format:': ' CD-ROM'},Masazumi Kotani,"It is very slow to scan incoming e-mail, and very slow to open website
I had AVG Internet Security and AVG is much faster incoming e-mail scanning, also much faster openning the websites",Very slow scanning incoming e-mail and webisite,1329350400,2.0,
776,1266,9939,9939,5.0,True,"04 9, 2015",A1BSCNMCI7LOAB,B00MYXTCIM,,Von,"This is my fourth year using TurboTax Home & Business. I love it. When I first started using it, I found I could use it to fill out city tax form. All the forms I have needed are supplied by TurboTax. It's cheaper than paying a tax preparer. I used an accountant to do my taxes the first year I went into business. I wanted to deduct something that he wouldn't deduct and he deducted something I didn't approve. I didn't realize it until after I filed. He charged me $500. Had I done it myself with TurboTax I could have received a much larger refund and could have saved on the cost of doing my taxes. I think TurboTax is Awesome.",Awesome,1428537600,,
935,2302,11263,11263,4.0,True,"11 30, 2015",A1J9LW078SZFQQ,B0144NYGJY,{'Platform:': ' Key Card [12 month]'},LLP,"I can't say I love Norton anti virus, BUT...
It seems to work much better than McAfee.
And I purchased it on sale with free prime shipping much, MUCH
cheaper than locally.
With McAfee and had one problem after another.
I Removed and reinstalled it 3 times and after the 3rd time I removed it.
I started using Norton and In the last 6 months I have only had
a slow start problem with the Norton 2 times.
I just purchased this one instead of the Renewal price.
So after 6 months, so far so good.",Norton Security Deluxe seems to work well.,1448841600,4.0,
477,1034,9300,9300,5.0,True,"05 18, 2016",A3C6C71ZKWJ9PG,B00KQV8RNK,,Amazon Customer,good,Five Stars,1463529600,,
718,2239,8081,8081,5.0,False,"11 18, 2014",A2YKWYC3WQJX5J,B00EZJRS8E,{'Platform:': ' PC/Mac Disc'},ShannonOnTheLakes,"While this isn't the Mavis Beacon I've known and loved since her humble beginnings in 1987, it's still a decent program to learn or simply use to brush up on your qwerty typing.

Gone are the games and 'fluff', this Mavis (who, btw, is a fictional character named after the developer's favorite singer, Mavis Staples)is all business.
This is a good, no nonsense way to learn.",Solid Typing Program,1416268800,,
769,1141,4463,4463,1.0,True,"01 9, 2012",A1MKYTB0PW16IS,B002JB3BC2,"{'Format:': ' Thin Software Download', 'Platform:': ' PC Download'}",G. George,"I give this product one star only because I can't give it zero stars!
I was lucky to get my money back and that was only because Amazon came to my assistance.",It's a Dog!,1326067200,,
355,1262,7438,7438,2.0,False,"09 14, 2013",A3VI2VETB90ZG5,B00CBFRH08,,J. Sullivan,"Software that is supposed to keep up with the latest in security threats, should also be able to keep up with the latest in operating systems. Without explicit Windows 8 support, it's hard enough to trust this thing to keep my computer problem-free, but when users need to refer to migration documents to upgrade form the older version, it makes it that much worse.",Lame,1379116800,,
634,754,9429,9429,5.0,True,"02 3, 2015",A3RWFSU4Z23JYB,B00LHTRE1G,{'Platform:': ' PC Disc'},pgc3,"Hard to beat for the money, what a deal!",Kaspersky,1422921600,,
294,1738,4430,4430,3.0,False,"12 17, 2009",A2R1HUYHXV7H18,B002J9PNZM,,Bugs,"This product was very easy to install.  It's also very easy to use, maybe too easy for me.  The user interface was about so user friendly I couldn't figure it out.  I think it might be great for people very new to computers and software.
That said, I couldn't figure out how to print something.  Took me a good 10 minutes to print something!  Now, I'm used to Photoshop and Gimp, and I was like ""Where are my tools?""
Tasks in this program are for the most part very automated, and the program performs them well. Functions like rotate and crop are OH so easy!
 One thing I really liked is that it has some special effects built in that are a bit like Alien Skin's and/or Nik's plug-in packages, and they come free, with nothing else to install or buy.  If you've ever bought plug ins like this, you will recognize that these are worth the price of the package.

I would have liked this program a lot more if not for some weird issue with providing a simple ""Save"" or ""Save As"" function.  You know, just those basic file functions in a basic file function sort of way.  The program has them all, of course, they are there, but the interface seems to hide them, in my opinion.  This can possibly cause disasters with working on a photo, and accidentally altering it without meaning to.
My advice, when you first get this software, is to play with some copies of pictures and learn how to save copies before you really jump on a picture you value.  The GUI could be much improved in this area.","Easy install, great for beginners",1261008000,,
