,Unnamed: 0,Unnamed: 0.1,Unnamed: 0.1.1,overall,verified,reviewTime,reviewerID,asin,style,reviewerName,reviewText,summary,unixReviewTime,vote,image
400,908,396,396,2.0,False,"09 25, 2002",A1522TN5FVJL0Y,B00005AFI2,,R. Geissman,I received a 30 day trial of this software from Microsoft. I used it to update my website that is hosted by Yahoo. I had to load the FrontPage extensions to the server then convert my current pages to FrontPage. This made me go through the process of reformatting nearly everything. The simple on-line tools that yahoo provides did a better job and quicker than this software. I suppose if you really are an office expert and want the look and feel of the office interface then you might like it. Otherwise I think you can do better elsewhere. This software takes the cookie cutter approach to building a web presence. Microsoft was offering a 30 day CD trial but have stopped that. I wonder why they don't want you to try it out any more before you buy it? Why indeed!,Why?,1032912000,,
555,958,11017,11017,5.0,True,"12 7, 2015",A25WJGW9I7O9HM,B011XO5JZM,,Harry DBH,Good in time updates my licenses.,Five Stars,1449446400,,
161,1712,7507,7507,3.0,True,"07 30, 2015",A2Q56N6TI0T525,B00CTTEKJW,{'Platform:': ' PC'},Shootability,ok,Three Stars,1438214400,,
798,2468,11340,11340,3.0,False,"11 16, 2015",A3RF46CL8GDIN8,B0148BYIAO,{'Platform:': ' PC Download'},NorthStar,"The product itself downloaded easily and works well. It's not that hard to adjust from Office 2013 to 2016, but I went ahead and got a 2016 guide anyway for those inevitable small changes that sometimes just can't get around. The only reason I don't give 5 stars is because of the increasing demand of personal info just to download and use this product. I like that they want to know how to make the product better but the requests for personal information are starting to get on my nerves. I always let the system report errors back to them anonymously, They shouldn't need to know who and where I am in order to download the product.",Office 2016,1447632000,,
196,506,11654,11654,5.0,False,"11 12, 2015",A2AC6GQ24S45GA,B015XDQD4K,{'Platform:': ' PC'},Patrick O,"A lot of features for not a lot of price, it does have a bit of a learning curve but they provide a lot of lessons and guidance on how to use each feature. If you have any background with video editing, this offers an easy step into some useful task, though not entirely advanced compared to other programs. I'd heartily suggest it for people who aren't willing or interested to jump in to the more professional programs, or are interested but they're budget isn't--but who want to have more creative possibilities than what a basic program like Windows Movie Maker or lower end/price programs. This is also a really good stepping stool for those higher end products. Get to know basics and exploration on this, then if and when you find you come to the end of what it offers, move on. The expensive programs really are overkill for the great majority of people (and I say this as someone who has the Adobe suite and realize that even as an educator I'm paying more than what I reasonably need to use).

Great middle ground software that would fit most people's needs and spark a lot of creative development",I should edit this,1447286400,,
298,315,5308,5308,4.0,True,"09 14, 2014",A2DW7QRJYJUY3Z,B004IKEKWC,{'Format:': ' Software'},rangerone,"item was as described, I was pleased with the purchase",I was pleased with the,1410652800,,
363,30,11696,11696,5.0,True,"02 3, 2016",A3RVG0QUY7R7LX,B01617VO2S,{'Platform:': ' PC Disc'},G&#039;Wood,The price was less than purchasing it direct from Intuit.,Possibly Best Price,1454457600,,
618,1692,5398,5398,1.0,False,"12 5, 2011",A680RUE1FDO8B,B004PIPG2A,{'Platform:': ' PC Disc'},Jerry Saperstein,"First impressions count - and my first impression of Corel's Video Studio Pro X4 is definitely negative. I have a long history with this product, going back to its days as Ulead's video editor. It was flaky then, stayed flaky in the occasional upgrade I've purchased and remains flaky in this most recent version.

  I needed an inexpensive video editor for another computer and I am up to my license limit on the other packages I own and my earlier VideoStudio packages are not Windows 7 compatible. This is certainly cheap enough, but true to its own traditions, it is not ready for prime time.

  For example, I tried to open two MP4 files created with the ArcSoft video product. Corel VideoStudio Pro X4 gave me a file mismatch error. However, Apple QuickTime, Avid Studio, Adobe Premiere Pro, Cyberlink PowerDirector 10, Avif Pinnacle 14 HD and Windows Movie Maker opened the MP4 files without difficulty. I noted in Corel's support forum that there are many reported problems identical or closely similar to mine. To me, that means sloppy coding and inadequate beta-testing and quality control, the same problems that have plagued Ulead/Corel problems for years. Oddly enough, Video studio Pro X4 would open other MP4 files created with the ArcSoft product.

  Next, I wanted to record from a DV source. Video Studio Pro X4 recognized the source, played the audio but would not display a preview of the video. I finally got it to work, but don't ask me how. The problem occurred on numerous occasion making VideoStudio very difficult to record with.

  I don't know what other unpleasant surprises are in store for me with Corel Video studio Pro X4, but based on past experience, there will be no shortage of them. On the other hand, the product is cheap - in more than just price - and this particular need doesn't require much more than the minimal capabilities.

  Overall, my initial impressions are negative. Should further experience change my opinion, I will amend my review. My advice though is that unless you absolutely can't afford a better video editing product, avoid Corel Video Studio Pro X4.

  I continued working with VideoStudio for another day and my impression has now solidified: it stinks.

  Repeated difficulties connecting to a known good DV device. Crashes so severely that the Windows 7 computer it was hosted on required a reboot. Usability is low with basic editing commands buried deep in the manual. Single frame key shortcuts, for example, are buried in the manual instead of in tooltips.

  My opinion: Corel VideoStudio Pro X4 is to be avoided.

Jerry","Problem ridden, poorly designed.",1323043200,2.0,
783,1027,2643,2643,5.0,True,"08 8, 2014",A2857LQW3WE18Y,B0000AZJY6,{'Color:': ' 0.8594631328'},Marva L.,Love them! Beautiful color!,Five Stars,1407456000,,
125,3068,2066,2066,4.0,False,"07 7, 2008",A1FRADBDXQPJJC,B000WEJYM4,{'Format:': ' CD-ROM'},Rayhan S,"This version is not very different from the current 2003 Outlook that I use. It's better to think of it more as an upgrade. The new features include:

1) Business Contact Manager
2) RSS Feeds

Also, this version is compatible with my older version of MS word so no problems there.",Decent features + Upgrade,1215388800,,
148,2664,11641,11641,4.0,True,"11 21, 2016",A1MOLMEBRO23PR,B015SWVD3M,,Daniel Young,great buy,Four Stars,1479686400,,
893,109,4362,4362,5.0,False,"01 25, 2010",A2JAEZ0FMAMJVW,B002I7LYBC,,A. H.,"In the past fifteen years or so, I've had experience with Norton, McAfee, ZoneLabs, and Kaspersky anti-virus and security software.  Bitdefender ranks right up there among the least problematic security suites I've come across.

I've had McAfee products that brought my computer to its knees and ZoneLabs products that interfered terribly with Internet browsing.  I haven't noticed any glitches so far with Bitdefender 2010.  It's the most transparent suite I've used.

I installed this software on a Pentium 4 HT with 2gb RAM that runs WinXP Pro.  Firefox still clips along, and the antivirus engine does a pretty quick job of working through the nearly 400gbs of files I've got on the 500gb hard drive.

There are many customizable options in the Bitdefender interface.  None of it is confusing, but there are a lot of options.  The software operates simply, though.  It doesn't throw numerous alerts at you every time you do something on the PC.  It knows which new programs to trust (whitelisting?) and allows them access through the firewall.  I haven't had a problem with malware on this machine.  It seems to be doing just fine.

In all, this is a worthy contender.  I rate it right up there with Kaspersky 2010, my other favorite suite at the moment.  It doesn't hog system resources the way other suites do, and it doesn't get in the way.  But it does its job.  What more can you ask for?",Running smoothly and effectively,1264377600,,
952,306,8652,8652,4.0,True,"08 21, 2014",A7QOOJUE2THEC,B00FFIO0NA,{'Platform:': ' PC Download'},Louis Gedo,"I've used this program for the past 4 years and it just works, taking me through the process step by step",Better than paying someone $200 to do my taxes,1408579200,,
341,1651,6127,6127,5.0,True,"04 20, 2015",A2BKS36BUQIB32,B005S4Y65I,{'Format:': ' CD-ROM'},04 ZRX 1200R &amp;#34;Kurt&amp;#34;,"Worked great saved me so much money versus a ""Pro"" brick & cement house""","Buy it if you love it, now they have changed & makes it awful",1429488000,,
30,2314,453,453,5.0,False,"02 28, 2003",A1QVFHPY8418HC,B00005MOTE,,monkuboy,"I was using Windows 98SE and overall was happy with it.  While I experienced some lockups and freezing, it didn't happen that often.  What prompted me to switch to XP was a desire for better memory management (Windows 98 doesn't do a very good job), more stability even though Win98 wasn't bad for me, and an overall change of scenery.  So finally I made the plunge, doing a clean install instead of trying to upgrade over 98.
The Upgrade Advisor that you can download from Microsoft.com was very useful.  Luckily everything except my NEC printer was compatible with XP.  Next, the Transfer Settings and Files Wizard that comes on the XP disk also came in handy.  It gathers all your settings and/or files from the ""old computer,"" saves them in a file (or transfers them directly - you have various options) which you can then put on the new computer.  I wound up transferring only settings using the wizard.  Originally I told it to transfer files too, but it copied too many things that were unnecessary and the result was way too big to fit on a cd.  I would advise copying your documents and other important files manually but letting XP transfer your settings.  That way you can be more selective about what gets transferred (assuming you are doing a clean install).
Installation of XP went very smoothly.  It identified all my hardware, and I was able to reinstall my software with no problems.  Using the Transfer Wizard to move the settings to the new installation worked fine and was a real time saver - it moved all of my internet and e-mail settings and messages over with ease.  All user input was very clearly explained and the process overall was quite simple.
Using XP: There's a lot I still have to learn, but so far the system has been stable and I notice memory is managed much better than under 98.  It loads faster and while the much more colorful layout took some getting used to, now it seems like 98 is in black and white by comparison.  I also use the ""clear type"" option for fonts and find that they are easier to read than under a ""normal"" display (it seems to me that the main difference is that clear type makes it darker and bolder).
I'm glad I made the switch.  I've read some complaints about installation experiences and also the strict registration requirements but my experience so far has been all positive (knock on wood, of course!).  It seems like the Microsoft engineers really gave this a lot of thought and put it into action.",I Guess I'm Lucky,1046390400,13.0,
216,326,7194,7194,5.0,True,"01 13, 2015",A1P3VXTAZSHUIP,B00A6TPHZS,,Spenn,No problem with the key I purchased. Installed Windows 8 OK and upgraded to 8.1 with minimal issues.,Key worked fine,1421107200,,
226,496,8764,8764,5.0,True,"10 30, 2016",A2KIIQX2TH70MR,B00FZ0FK0U,{'Format:': ' Software Download'},C,"I my self have used WEBROOT for more than a few Years on Windows XP, VISTA, 7, 8.1, 10 to present windows 10 new update to version1607...
WEBROOT works great for me!!! NO Trouble at all...I used NORTON : (  and don't like Norton ad Not A fan of Norton used more than a few times The Free Version of Norton Is GREAT!!! but the one you Pay for YUCK!!! it uses to much space on your Hard drive and at times lock you off being able get online and ties the computer up...",WEBROOT works great for me,1477785600,,
311,1770,10590,10590,1.0,True,"05 4, 2016",A2OPWMG3XM3W1T,B00SWCP8CI,,Tammi,Bad,bad,1462320000,,
151,138,8281,8281,5.0,True,"12 17, 2014",A197GS9TRBOKX8,B00EZQYC8G,{'Platform:': ' PC Disc'},JIM R.,One of the best Internet Security pieces of software today. Worth the investment.,Norton Works Well,1418774400,,
155,1475,10909,10909,5.0,True,"02 3, 2016",A1PKJZRM97ELT8,B010P91LYY,{'Platform:': ' PC/Mac'},Widgeted,Seems to work great and much less expensive than Norton,Five Stars,1454457600,,
543,2702,3319,3319,3.0,False,"08 16, 2009",AG90OGHDGOOVH,B0017KEA6W,,David Stapleton,"In brief,
- the software installed without problem on my Windows Vista 64 laptop,
- the GPS dongle works as intended, but must be outside to get lock on satellites (as expected)
- trip plotting is reasonably efficient, but not perfect (I'd like to see an option that minimizes changing freeways as long as it does not add more than a few miles to the overall trip distance, that would be really useful in packed urban areas like Los Angeles with numerous interchanges)
- works as well as my Garman nuvi 760 with the big exception of the form factor

The bottom line question is ultimately, Is it useful? I have to answer no, not really. I can get maps and trip directions from the internet in most cases for free. For actual, real life driving, a dedicated GPS wins out if for no other reason than that the form factor of carrying a laptop (even the new netbooks) is just too cumbersome for ease of use and safe viewing while driving. This is not to say that the product doesn't work, just that there are better or cheaper solutions on the market to fill the need.
P-)","Useful, well sort of...",1250380800,,
234,1235,5726,5726,4.0,False,"12 20, 2012",A17A1KTVI3DG6U,B005AAWP1W,,Nathan A. Edwards,"I have been using Maximum Security '12 for almost a year now, and I have to say that I prefer Trend Micro products.

It is undeniable that Trend Micro catches some flak from industry critics, which concerned me at first. I utilized Trend Micro in '10, saw some of the reviews for the company, and subsequently tried a few of the critically acclaimed heavy hitters for my PC protection in 2011. The fact is, almost every other program I tried annihilated my computer's performance in comparison to Trend's light load. What's more, because of the rather typical use of my machine, Trend seems to do just as good of a job protecting my PC as the big gun programs that bring it to a grinding halt.

All in all, I don't seem to require more security than what Trend provides, and I definitely require more performance out of my computer than what many other programs permit. This being the case, Trend Micro's PC security options will be my go-to preference moving forward.",Not a burden,1355961600,,
414,1396,7056,7056,5.0,True,"02 8, 2013",A2U0LXK29W2U6,B009CCVMOU,{'Format:': ' Software'},GmaH in SC,I buy this every year.  It's simple to use and a lot cheaper than an accountant.  Use it every year and it keeps track of former returns so you can't accidently skip an entry.,It works,1360281600,,
724,1322,10835,10835,5.0,True,"09 6, 2017",A1O16J4RN90W3H,B01019T6O0,{'Style:': ' USB Flash Drive'},CD music collector,Great software upgrade and easy to use and install. Later qualifies you for upgrade to the latest Windows 10 Creators Home edition. Great system and works great!!!,"Great software upgrade quick, easy, and straightforward to use and install!!!",1504656000,2.0,
612,27,11297,11297,4.0,False,"06 18, 2016",A3W4D8XOGLWUN5,B0148BYIPY,{'Platform:': ' Mac Key Card'},Michael Kerner,"I honestly have to say that when it does come down to computer software, Microsoft has been the leader at getting the programs out to the public, and has taken a very strong stance at delivering the best for all your PC needs. But while Microsoft has been so dominant with those needs, Apple has been one of those companies that has delivered with external devices brilliantly, especially with the Ipod and Itunes assertively. But for word processing, it has been your choice of one or the other. But there are also those whom are just not really thrilled about getting into a subscription service for MS Office 365. They may have just one computer, and only one for those needs. Well, this would be a good buy for those with only 1 Mac computer for those simple needs. Microsoft Office 2016 for 1 Mac computer, works just as strongly as the Office 2016 for the Windows computers, and you do have all the simple features including Word, Excel & many of all your office software needs. It runs very smoothly, and doesn't have a lot of flaws when installed. It works very nicely with updating all your old files from Word and some from other word processing suites like Corel, and converts them so well. It really stands up well for the money, and runs very smoothly on the Mac computers. I sincerely recommend this suite for your Mac computer. While Microsoft has been so geared on Windows, they have some really good pieces for the Apple brothers.

Price: B

Convenience & Setup: B 1/2-

Overall: B",Apple's Windows Helper,1466208000,,
322,990,11538,11538,5.0,True,"10 8, 2016",A6M01NDCD957E,B015724RQI,{'Platform:': ' 10D PC/Mac Download'},James McDonald,Great as usual,Good Product,1475884800,,
465,2361,11059,11059,3.0,False,"11 13, 2015",A2BB4DGBRVGKWW,B0123C648Y,,A Customer,"I am an artsy type, but also lazy. I loved art class in school because I had a whole room full of supplies, though I hated cleaning up. I was really looking forward to using this software because it simulates all of that messy stuff which is fun to use but not convenient. Fun times ahead!

It's mostly a fairly straightforward painting/editing program, but it has a whole ton of ""brushes"", both simulated real art tools (paint brushes, pens, spatulas, airbrushing, etc) and some wacky fun stuff like the ""image hose"" which lays down a trail of objects. If you're a skilled hand artist, or planning to become one, many of the brush types will be very useful in creating digital images which do look very much like they were created with brush, pen, or sponge strokes.

However, for what I expected to be a pretty high-end piece of software, I was disappointed with some quirks.

To avoid using the word ""tool"" (often used to refer to editing tools) and also avoid calling everything a ""brush"", I will refer to all simulated things as implements.

Some of the implements are too perfect and constant, and obvious patterns show. The ""loaded palette knife 2"" strokes with a pattern you might expect from a scraping painter's knife, but it NEVER CHANGES, down to the pixel. And unlike some of the other implements, there's no rounding or smoothing of the stroke to make it look convincing. It's exactly what you would get by copying and dragging a row of pixels in a paint program on an old DOS box. See the uploaded image, it's loaded with patterned artifacts. Utterly useless. Some others had similar problems, but I remembered this knife as the worst.

Some implements which rotate to match the stroke direction have a similar problem. They are completely 2-dimensional, and while they make delightful swirls of texture, they ALWAYS start and end with a completely flat row of pixels, just as no object in the univers would if used to draw. Again, it looks like the obvious result of a paint program.

One feature I was initially happy to see is the ability to zoom in with the mouse's scroll wheel. Why that isn't universal I have no idea, and being a detail hawk I am constantly zooming in and out at various points. Great! But it's silly, because using your scroll wheel will only zoom in to the exact center of your screen. The program doesn't care where your cursor is! So you have to first drag over to center whatever area you want to zoom in on. How did they not think to make it zoom in on the area I am pointing at? Yes, I can drag to the area first, but zooming in & out is something I might do literally hundreds of times while working on one image.

I was not able to figure out why trying to pick the crop tool sometimes jumps my focus down to the canvass layer, which is surely the last layer anyone would want to crop and move. Unlike some other things, there was no popup telling me why it didn't want to let me crop the paint layer.

Here's another silly thing. The escape key does not un-select things. If you use the select tool, and have the dotted box around an area then either perform some action or change your mind, you want to un-select the area. In every other program I have used, either ESC or ENTER will unselect the area and let you move on with your life, which is handy because you can draw with your right hand and hit keys like that with your left. In Corel, you have to use the ""reset tool"" on the menu bar. Again, it might not seem like a big deal but it interrupts the flow of an action you might do hundreds of times while working on a serious project. And it's not like the ESC key does anything else.

And finally, though the number of tools is impressive at first, it's all about buying upgrades. Want more brushes? Hand over a chunk of cash. It looks like the ""image hose"" is the same, and you can only use leaves and tires so many times before your work looks like a child got on your computer when you weren't there.  When the program first started, this really convenient learning interface popped up. Oh good, something to get me started! Not really, they're all ""30 lecture"" bundles you have to buy. No free 5-minute intro to using Corel's mediocre interface.

Overall, it's got some good stuff. But don't think you're buying into some great thing. They think they're selling you a bare-bones system, some of which can be addressed with upgrades and some maybe not.",Expected better,1447372800,9.0,['https://images-na.ssl-images-amazon.com/images/I/61R--+XleWL._SY88.jpg']
818,1609,6522,6522,2.0,False,"05 14, 2013",A105S56ODHGJEK,B008414ZYY,{'Format:': ' CD-ROM'},Peace Daddy,"I was expecting a bit of a learning curve with Sage 50, but after spending several hours with it, it ended up being way too complicated and not worth the effort in wasting any more time. Unless you're already familiar with the program or have somebody who knows what they're doing working with this, I can't recommend it. It's just not worth the extreme hassle -- they could have made this much easier to learn for the average person, or even somebody with a little knowledge in the area like myself.",Way too complicated,1368489600,,
951,812,12467,12467,2.0,False,"01 23, 2013",A6VPK7X53QNAQ,B003CIPI9A,{'Platform:': ' PC Disc'},Zen,"To register this software you must call a number and be subjected to an extreme sales pitch to upgrade. After that you find that this is a page publisher like MS Publisher to create newsletters etc. There are some useful features but it will feel clunky to those used to the Microsoft interface or even Photoshop Elements etc.

Overall, this is a good entry level software if you can avoid the registration hassle. I'd evaluate the free trial version before going in for the purchase.","Some good features, registration is not worth the pain.",1358899200,,
415,683,8534,8534,5.0,True,"03 11, 2014",A3AP2MA7YIWA4F,B00F8K9N32,{'Platform:': ' PC Disc'},Rick In NorthEast,"Review is about the PROGRAM, not Amazon.
This is the Business(ONLY) version and does NOT come with a free State.
(The other four types do...)
It is NOT for personal income taxes. (1040, etc.) SPECIAL USE ONLY...
My Mom died and it will cost (quoting inflated list prices) $200 to fill out a couple
forms to say ""she"" made a little money after her death...
I've heard other companies software products are less but are poor at this section...",Business version is a rip off. (By Intuit.),1394496000,,
