,Unnamed: 0,Unnamed: 0.1,Unnamed: 0.1.1,overall,verified,reviewTime,reviewerID,asin,style,reviewerName,reviewText,summary,unixReviewTime,vote,image
759,448,8197,8197,4.0,False,"12 17, 2013",A3G7BEJJCPD6DS,B00EZPXVWU,{'Platform:': ' PC/Mac/Android/iOS'},Clevelander83,"I'm not very tech savvy and look for comprehensive virus/Internet protection that is simple to install. Norton has fit the bill for many years. Norton does require renewing your licenses every year - as do most other makers of virus protection - but I feel that I get something for my buck as they constantly add additional features.

I used the disc to download the software and it was hassle-free. (I see that others commented on downloading from Norton's website to ensure that you're getting the latest version, but I find the disc download much easier and faster)

I don't own a Mac or any Android devices, but really like that Norton extends protection to iOS as I can now protect my iPad and iPhone. Five licenses will be plenty for most households. I think the Scream Alarm is nifty for locating my constantly missing phone; Remote Locate is also a nice feature if your device is stolen but Find My iPhone/Find my iPad apps on Apple products do essentially the same thing.",Trusted Protection for all my Devices,1387238400,,
9,2159,1410,1410,3.0,False,"02 27, 2008",A17BUUBOU0598B,B000HCVR3A,,Mark,"Microsoft's Office Standard 2007 is the version that includes the programs most people will be looking for in an office suite: Word, Excel, Powerpoint and Outlook.  While Microsoft did make some improvements, many changes have users frustrated and mad.

Pros

+ Standard version includes the 4 programs you actually want!
+ Like most new MS suites, allows for easier transfer between machines
+ Allows you to use on your home desktop AND your laptop!!  Huge plus!!
+ New open document format based on xml - good for techies
+ Alternatively, you can still use the doc format you know and love
+ Excel now supports larger documents with more fields!
+ Cool new Powerpoint extras
+ Once you do overcome the learning curve, design has some plusse
+ Preloaded with Vista OEM computers, so install is MUCH faster than old version

Cons

- A list price of $400 means many will forgo Outlook and buy Home & Student suite for MUCH LESS
- The ribbon puts things in WEIRD places
- Microsoft disabled classic menus so you can't find stuff ... ARGH!!!
- Startup times seem a little slower ... why????
- Strangely slow performance with Word

The general hatred for the ribbon is well known.  Microsoft Word and Excel have drawn the most heat.  It took everybody years to learn those nested menus and hard to find functions.  Now they are all moved!!!!

Actually, the ribbon wouldn't be so bad if you could have your regular old classic menus above it.  Once you learn the ribbon, there's some logic to the way things have been relocated.  Still, this was a huge blunder and I wonder if MS will back track on that.

This guy also includes Outlook, which is a MUST for me since I have to use Outlook on my work PC.  I tried using the exported files in the new vista calendar apps, and none of them really worked that well.  The professional&nbsp;<a data-hook=""product-link-linked"" class=""a-link-normal"" href=""/Microsoft-Office-Professional-2007-FULL-VERSION/dp/B000HCVR30/ref=cm_cr_arp_d_rvw_txt?ie=UTF8"">Microsoft Office Professional 2007 FULL VERSION</a>&nbsp;and ultimate&nbsp;<a data-hook=""product-link-linked"" class=""a-link-normal"" href=""/Microsoft-Office-Ultimate-2007-FULL-VERSION-DVD/dp/B000HCTY26/ref=cm_cr_arp_d_rvw_txt?ie=UTF8"">Microsoft Office Ultimate 2007 FULL VERSION [DVD</a>] suite versions also include outlook.

Yet why the list price of $400?  The Home and Student Office 2007 suite&nbsp;<a data-hook=""product-link-linked"" class=""a-link-normal"" href=""/Microsoft-Office-Home-and-Student-2007/dp/B000HCZ8EO/ref=cm_cr_arp_d_rvw_txt?ie=UTF8"">Microsoft Office Home and Student 2007</a>&nbsp;is $150 and includes everything here except for Outlook.  Is Outlook worth $250 now? To be fair, there are cheaper upgrade versions.  Still, I may be switching to a new email / calendar / productivity program all-together.

The new XML doc format is Microsoft's way of getting away from the proprietary .doc format.  This will aggravate some people too, but you can just save everything in the 2003 format.  I like the new format and I think it will catch on with time.

Despite the short comings, once you get past the learning curve the programs themselves are improved.

Enjoy!!!","MS Office Standard 2007 - Steep Price, Steep Learning Curve, Slippery Slope!!!",1204070400,87.0,
744,282,7101,7101,5.0,True,"04 28, 2013",A1BL7D7OGIVB6B,B009HBCU9W,{'Format:': ' Software Download'},j d midyette,"At this point I have been using Ttax for the at least the past 15 years (been so long now I really don't know exactly).  I have found it to be a truly outstanding method of preparing my personal tax return.
By the way, did I mention that I am a CPA!",Use It Every Year,1367107200,,
661,1948,4179,4179,5.0,False,"10 22, 2009",A1QOK9LU90ACF7,B002DHGMK0,,Centriculous,"I've been using Windows 7 since its beta release, but my laptop's been running the final version for weeks now. I really disliked Vista and preferred XP still, but Windows 7 has tipped the scales...finally. Windows 7 has been reliable and it's snappier than Vista.  Windows 7 sips laptop battery power so my 1-year-old Dell XPS M1530 runs longer under Win7 than it did under Vista.  But what I really like about Windows 7 are the new and improved features it offers. Here's a list of my favorites:

#1 VIRTUAL LIBRARIES
With virtual libraries, the special folders like Documents, Pictures, Music and Videos have all become libraries. Instead of being a physical storage location, they're indexes that point to one or many locations on the computer you're using, as well as other computers you're networked with. In a home setting, where you're running Windows Home Server, you can now easily direct file stores to your server.  Also in the home, housemates can easily see each others' data by including their respective folders in one another's libraries. When you search a library, you're searching your computer and any other computer that has folders you've added to your library.  You determine which physical location will be the default location for saving new files to your library.  This is, for me, the single best feature of Windows 7, and is an excellent reason to upgrade.

#2 START SEARCH
The Start Search has been improved in Windows 7 so results appear instantly as soon as you click the Start button, and then either type the name of a program on your computer, or a task you'd like to perform (like, ""change my display settings""). No more hunting folder hierarchies to find that elusive program, or spend time figuring out where Microsoft has placed something in the Control Panel. This is a tremendous time-saver.

#3 AERO SNAP
The Aero user interface has three new tricks -- Shake, Peek, and Snap -- but only Aero Snap is a major leap forward. Have you ever tried comparing the contents of two windows together, side-by-side? It's painful to do because you have to fiddle with resizing the two windows. With Aero Snap, now all you do is grab the title bar of one window, sling it to the left, and Windows 7 will automatically resize the window to fill-up one-half of your screen display. Do the same with a 2nd window by slinging it to the right, and it'll fill-up the right-side of your display. You can start comparing two windows in...an Aero Snap. Aero Shake and Peek are cute, but not nearly so helpful.

#4 TASKBAR
Gone is the Quick Launch bar that too many people didn't know existed. Now, the whole Taskbar is a quick launch bar -- drag and drop any program icon onto the bar, and you're one click away from starting the program. Also, it's so easy to move the taskbar around now. I keep it on the left vertical on my computer. Gone is the system tray, too -- Notification Area takes its place. The Action Center alerts you to anything you need to do to keep your computer working smoothly.

#5 PROGRAM COMPATIBILITY
Any program can be run in one of many compatibility modes now. Windows 7 has a wizard that will help you pick the right, earlier version of Windows under which to run an older program -- just right-click on the program icon and choose ""Troubleshoot Compatibility"". Or, You can do the same thing more quickly by right-clicking on a program icon, click the Compatibility tab, enable Compatibility mode, and select the earlier version of Windows you want to run with your program.

#6 STICKY NOTES
Less functional that the Vista Sticky Notes -- which nobody used -- but now I actually use Sticky Notes to put reminders on my Desktop. They're quick, easy, and work just like a regular Post-It note only you don't get fingerprints on your screen!

#7 JUMP LISTS
There are two kinds -- Jump lists that let you quickly pick a task to perform, and Jump lists to quickly select a document to open and edit in the associated program. Jump lists include most recently used files, or you can pin your own files, too.  These are nice time-savers.

#8 SAVED SEARCHES
In Windows Explorer, you can create filtered searches and then save them in your Favorites for later use. This is handy to find filtered data in the future. When you re-execute the search, it creates a dynamic results set (so your search is never stale).

#9 CONTENT VIEW & ARRANGING
Also in Windows Explorer, two new features. Now you can arrange a folder into subdivisions by date (great for your pictures folders!). You can use the Content view to combine thumbnails of files along with details that usually are found only in the Details view.

#10 USER ACCOUNT CONTROL
Most everyone hated UAC in Vista (even though it helped to keep your computer safe). In Windows 7, Microsoft tamped down the annoyance factor of UAC. You can change your date and time without setting off UAC, for example. You can also decide whether UAC should go into secured Desktop mode whenever it does get triggered (secured Desktop is when your screen darkens and you're forced to respond to UAC's dialog box asking permission to run a program or make a change to your system). You can easily turn-off UAC, too.

#11 PAINT, WORDPAD, CALCULATOR
All three of these utilities got updated. Wordpad and Paint have the Office-like ""ribbon"" now, and Calculator has a few new memory keys, touch sensitivity, and a Programmer view for those dealing with hexidecimals and binaries.

#12 HOMEGROUP SHARING
This is the easiest way to share data with others in your (home) network. HomeGroup creates a password that is shared among computers, and that takes care of all the issues with user accounts, file permissions and ""access denied"" problems. This is great for unsophisticated home networks.  I made this feature last because I'm not using it -- I just think it's a great idea for inexperienced users.  Note:  all the networked computers need to be running Windows 7 to make HomeGroup sharing work.

In short, think of Windows 7 as Windows Vista done right.",Windows 7 is Windows Vista done right,1256169600,95.0,
49,1838,5310,5310,5.0,True,"07 13, 2014",ANG2AWNVEZR57,B004IKEKWC,{'Format:': ' Software Download'},Amazon Customer,Excellent!,Five Stars,1405209600,,
421,2996,4256,4256,5.0,True,"03 29, 2013",A3AP2MA7YIWA4F,B002DHLUWK,,Rick In NorthEast,"Win7. What is there to say? It is a god solid well tested OS.
I like it better than Win8 since I use a desktop and have NO touch screen.",Win7,1364515200,,
464,1484,9676,9676,5.0,False,"05 9, 2015",A2MYM0XC5JNHBS,B00MHZ6Z64,{'Platform:': ' PC/Mac/Mobile Download Code'},James Cothern,"I have been using this product ffor several years. If you catch it on one of the introductory download specials in the fall, you can pay about 1/3 of t he usual price for the product. Quite easy to install and a great buy for multi computer protection.",Down Load is the Way to Go,1431129600,,
409,524,2984,2984,3.0,False,"06 25, 2009",A1JZFGZEZVWQPY,B000X86ZAS,,Professor H,"Works ok on Mac. As other reviewers have stated elsewhere the windows version works smoother and this version is not as robust as the one it replaces. That being said it does what it is supposed to but.... the days of the Microsoft Office being a needed program are fading fast. With open office and the word processor already on Mac (pages) along with open office and of course google docs I can see the day when they will hardly be able to give Microsoft Office away. Pages does the just about the same thing cheaper and Pages is the one I use most,",Works ok,1245888000,,
24,2216,6699,6699,5.0,True,"04 15, 2013",A3HJHV83O2U8BL,B008S0IE5M,{'Format:': ' Software'},Robert A. Grossman,Been a Quicken user for years. While the software has an occasional bug it really is occasional and when it comes to tax time I find it's accurate and I've got all the reports I need for our corporation. That's what matters to me,Does what I need it to do,1365984000,2.0,
416,1503,9345,9345,5.0,False,"07 17, 2017",AM13JILBPTHYF,B00L13X6QA,,Geever,"best product out there, highly recommended",Five Stars,1500249600,,
721,1078,6774,6774,4.0,True,"09 13, 2015",APADTEN8OKDDT,B008XAXAC4,{'Platform:': ' PC Download'},Bruce Dudley,Good.,Four Stars,1442102400,,
901,1354,10838,10838,4.0,False,"12 12, 2015",A2EMUM49CE0JV4,B01019TDJ8,,Mark S. Mocarski,"There is a Amazon-answer--that's not really true.
===
Be very careful about Windows 10. If you have a custom rig, DO NOT CHANGE TO WINDOWS 10! I have a custom rig (not a typical store bought desk top) and Windows 10 is like a poison to it. Screen freezes up, frequent crashes, etc. I sorry I ever bought it and uploaded it. Since it was uploaded over 30 days ago, there is no going back to Windows 7. I can't believe Microsoft would market a software system that is not compatible with desk tops that are not store bought/that are customized. Again, if you have a custom rig WINDOWS 10 IS POISON.  see less
 By Longest Train on December 5, 2015
===
I build my own.
I did the Win 10 free upgrade. I took a week to get completed.
Before adding the free upgrade--I upgraded my Win 7 PC to a 64-bit version.
And removed my PCIexpress cards.
I ran integrated.
I remained integrated for the following weeks using Win 10 Home.
But was able to return to a Win 7 environment.
Added back my PCIexpress audio and video.
===
Its a PC I built using Amazon.
Core 2 Duo (e7500)
800-MHz RAM
HP DVD drive
500 watt PSU (bought from PC Power and Cooling)
Windows[tm] 7 Home Premium SP1
Creative-audio
Sapphire-video
===
Make the process easy and look at hardware upgrades.",Windows[tm] 10 OS,1449878400,,
292,1326,873,873,1.0,False,"10 31, 2008",A1LCS3WQEWUO6Y,B00022PTT8,,Amazon8892,"Generally speaking, to get the best performance from any operating system a clean install of a full version is recommended. The best choice is to choose a full version of the product and enjoy the benefits of not being left with artifacts and leftover's of your previous operating system which can lead to instability in certain cases. I would only buy this on a limited budget.",Upgrades are never as good,1225411200,4.0,
112,2053,9707,9707,4.0,False,"03 3, 2015",A3SLC8F6VIWXIR,B00MILM2FA,{'Platform:': ' PC Disc'},John T. Horner,"This software will help walk you through a job many people ""never get around to"". It isn't perfect, and isn't the way to go if you need to set up trusts or having a great deal of assets. But for the vast majority of people this is far, far better than the alternative .... which typically is doing nothing.

Walks you through the basic questions and forms all of us should deal with sooner than later.",Helps you get an unpleasant job done,1425340800,,
929,2732,4380,4380,1.0,False,"02 24, 2010",ASY25YMTIC2A9,B002I7PGT8,,Grace,"I first tried Bitdefender Antivirus 2010 and found it reasonably good... the definitions were extensive, but it slowed down my system at times. It seemed more stable then the previous antivirus programs I've used, so I went ahead and updated it to Bitdefender Internet Security 2010 after about two weeks of use. Worked the same for a while until I started really noticing the difference between these programs and my last antivirus program, Spyware Doctor.

When I first installed Bitdefender Antivirus 2010, it found a couple of problems that Spyware Doctor didn't. However, since then it's found almost nothing, which is strange... when I used Spyware Doctor, I would scan every night and find four or five minor problems (tracking cookies, etc) over the course of a week. This program hasn't found anything in the last two months. I finally reinstalled Spyware Doctor and came up with several minor security risks that Bitdefender ignored. My definitions are automatically updated, so that isn't the problem.

After about a month of using it, I began having strange problems. First, Bitdefender's firewall suddenly began causing problems with programs that were normally allowed to access the internet. I tried removing them from the exceptions list then re-adding them, but nothing worked. I finally gave up and disabled Bitdefender's firewall and everything worked fine again. I emailed their support, but never received a response.

Second, around the same time I began having computer lockups... my computer would stop responding and run EXTREMELY slow. At the same time, the Bitdefender icon in the taskbar would turn grey with the message telling me that Bitdefender encountered a problem and I need to restart the computer. It usually cleared itself up within a few minutes, but would reoccur randomly. Sometimes it would go several days, other times it would happen two to three times in a single evening. I finally had to shut down the real-time monitoring, which seems to have cured this problem.

Well, after shutting down the process scanning and the firewall, and not being happy with the daily system scanning, what's left? Email scanning is flaky at best (will suddenly mark a single email in the middle of an entire conversation with a friend as 'spam'), and it's extremely slow (2-3x as long to check email). I also hate the fact that every time it finds a spam message it gives you a pop-up. I haven't found a way to shut these off, but by now I've given up and have moved on. One of the worst antivirus programs I've ever used.",Garbage...,1266969600,,
910,501,5306,5306,5.0,True,"05 30, 2015",A3OKJR8V2MR3Z9,B004IKEKWC,{'Format:': ' Software'},Robert Manning,Norton does not offer 360 any more. Have to buy a older version and have it up date.,No More,1432944000,,
59,378,7824,7824,5.0,True,"05 4, 2014",A327HI0M9QL7JR,B00E6ONJJU,{'Platform:': ' PC Disc'},Robert A. Hansen,I prefer Kaspersky over any of the free anti-virus programs out there.  Kaspersky is simple to use.  It is fast and works well.,better tha avast,1399161600,,
832,2747,10662,10662,3.0,True,"07 26, 2016",A2FUAY203GSOQ1,B00U3H6626,,Private,Satisfied,Three Stars,1469491200,3.0,
595,556,3018,3018,3.0,False,"07 9, 2009",A1GQRGB8FGSLIZ,B000XHE0Q0,,Amazon Customer,"If you are in the corporate world and work extensively with Excel or you have the need to use Entourage with Exchange than I do recommend buying Office 2008. However, if you are person who just does word processing or presentations then IWorks 09 will work for you. IWorks 09 will open Office 2007 documents.

As far as the special edition, I did not really use it because I have been a Macromedia/Adobe user for too long and will continue to use their products.

Yes I do recommend to product; however, I suggest you download the 30 day trial from Microsoft prior to deciding to buy it.","Not bad, it just does not really shine",1247097600,2.0,
213,232,3232,3232,5.0,True,"10 14, 2009",A32B6XWNR55SRL,B0014X4MWO,,James W. Durney,"This is about the best screen capture software product available.  Snagit captures from every product I have tried it on saving in a multitude of standard file formats.  The product is easy to install with free upgrades and full technical support.  I only use the capture feature for pictures but there are multiple types of captures possible.  Once saved, I have a standard JPG file that can be attached to an email, embedded in a newsletter or just enjoyed as part of a screensaver.
The company has a full set of tutorials and simple documentation is provided.",See it  Snagit  keep it,1255478400,2.0,
263,1430,2971,2971,5.0,True,"05 7, 2010",A1R0LNM873ALSV,B000X86ZAS,,MacInTX,Finally a Intel-native version of MS Office for the Mac. Much quicker to launch than the previous version.,A good update,1273190400,,
633,1894,1281,1281,5.0,False,"09 24, 2005",A3F8WKYFSG339Z,B000EORV8Q,,R. E. Griffin,"Smallest 4 port hub that I could find.  I use it to recharge power on my road warrier devices (cell phone, mp3 player, camera, etc) from my laptop... using USB cables/plugs from boxwave.",Small flat USB for four - Nicest!,1127520000,,
373,169,12284,12284,5.0,True,"12 9, 2017",A1DSGNHMAGNLTZ,B000IAMRXK,,P. Barrett,Ok,Ok,1512777600,,
